{"model_meta":{"attempts":1,"budget_class":"typical","cells_out":16,"chars_out":338,"decode_kwargs_accepted":{"max_new_tokens":864},"est_cells":48,"est_source":"vision_lines","sec":1.294},"schema":"vlm.response.v1","tables":[{"cells":[{"c":0,"r":0,"text":"BKOC MITDE"},{"c":1,"r":0,"text":"WGLCP ID 3032"},{"c":2,"r":0,"text":"WGLCP ID 3032"},{"c":3,"r":0,"text":"WGLCP ID 3032"},{"c":0,"r":1,"text":""},{"c":1,"r":1,"text":""},{"c":2,"r":1,"text":""},{"c":3,"r":1,"text":""},{"c":0,"r":2,"text":""},{"c":1,"r":2,"text":""},{"c":2,"r":2,"text":""},{"c":3,"r":2,"text":""},{"c":0,"r":3,"text":""},{"c":1,"r":3,"text":""},{"c":2,"r":3,"text":""},{"c":3,"r":3,"text":""}],"cols":4,"rows":4}],"text_blocks":[{"text":"```json\n{\n  \"rows\": 4,\n  \"cols\": 4,\n  \"cells\": [\n    {\n      \"r\": 0,\n      \"c\": 0,\n      \"text\": \"BKOC MITDE\"\n    },\n    {\n      \"r\": 0,\n      \"c\": 1,\n      \"text\": \"WGLCP ID 3032\"\n    },\n    {\n      \"r\": 0,\n      \"c\": 2,\n      \"text\": \"WGLCP ID 3032\"\n    },\n    {\n      \"r\": 0,\n      \"c\": 3,\n      \"text\": \"WGLCP ID 3032\"\n    }\n  ]\n}\n```"}]}